What is a tibia?,The tibia is the larger bone in your lower leg.
What are symptoms of Carpal tunnel,"Symptoms usually start gradually, with frequent numbness or tingling in the fingers, especially the thumb and the index and middle fingers."
What is carpal tunnel?,"Carpal tunnel syndrome occurs when the median nerve, which runs from the forearm into the palm of the hand, becomes pressed or squeezed at the wrist"
What is a stress fracture?,"Stress fractures are tiny cracks that develop in the weight-bearing bones of your body, including your shinbone. Stress fractures are usually caused by repetitive force or overuse, such as running long distances."
What is a herniated disk?,"Your backbone, or spine, is made up of 26 bones called vertebrae. In between them are soft disks filled with a jelly-like substance. These disks cushion the vertebrae and keep them in place. As you age, the disks break down or degenerate. As they do, they lose their cushioning ability. This can lead to pain if the back is stressed. A herniated disk is a disk that ruptures. This allows the jelly-like center of the disk to leak, irritating the nearby nerves"
What is muscle dystrophy?,Muscular dystrophy is a group of diseases that cause progressive weakness and loss of muscle mass.
What is anemia?,Anemia is a condition in which your blood has a lower-than-normal amount of red blood cells or hemoglobin.
What is the Placebo effect?,"Placebos are usually though of as sugar pills. They are important phony treatments that are used to keep doctors and patients honest in testing new drugs or procedures. To prove that a drug works, it is generatlly tested against a placebo: a dummy medication that should have no effect on the condition."
What are Lipoma symptoms?,"Lipomas can occur anywhere in the body. They are typically situated just under the skin. They commonly occur in the neck, shoulders, back, abdomen, arms and thighs. They also move easily with slight finger pressure. Lipomas are typically less than 2 inches in diameter, but they can grow. Lipomas can be painful if they grow and press on nearby nerves or if they contain many blood vessels."
